{
  "schema_version": "bead-selection.v1",
  "request": "Find the Bead to work on for src/api/handlers/user.ts",
  "mode": "search",
  "selected_bead": {
    "id": "bd-305",
    "title": "Implement user handler authentication",
    "status": "open",
    "reason": "Only Bead with exact file match for src/api/handlers/user.ts, ready, unblocked, and has sufficient PageRank."
  },
  "commands_used": [
    {
      "command": "bv --robot-file-beads --file src/api/handlers/user.ts",
      "why": "Searched for Beads associated with the specified file path."
    }
  ],
  "graph_evidence": {
    "primary_signal": "exact_file_match",
    "signals": [
      { "bead_id": "bd-305", "metric": "pagerank", "value": 0.28, "source_command": "bv --robot-file-beads --file src/api/handlers/user.ts" },
      { "bead_id": "bd-305", "metric": "ready", "value": true, "source_command": "bv --robot-file-beads --file src/api/handlers/user.ts" }
    ],
    "blockers": [],
    "rejected_candidates": [
      { "id": "bd-301", "reason": "Higher PageRank but only parent directory match and blocked." },
      { "id": "bd-303", "reason": "Related via description but no direct file association." }
    ]
  },
  "next_action": { "command": "br update bd-305 --status in_progress", "destructive": false },
  "caveats": []
}
