{"schema_version":"bead-selection.v1","request":"Find the highest-leverage Bead tagged with label \"performance\" to work on next.","mode":"label_focus","selected_bead":{"id":"bd-302","title":"Cache expensive report aggregation","status":"open","reason":"It is ready, has the highest PageRank (0.32) among ready performance-labeled Beads, and unblocks bd-315. Although bd-303 has higher PageRank (0.41), it is blocked by bd-304."},"commands_used":[{"command":"bv --robot-label-attention","why":"Analyzed performance-labeled Beads for readiness and priority signals."}],"graph_evidence":{"primary_signal":"highest_pagerank_ready_within_label","signals":[{"bead_id":"bd-302","metric":"pagerank","value":0.32,"source_command":"bv --robot-label-attention"},{"bead_id":"bd-302","metric":"unblocks","value":1,"source_command":"bv --robot-label-attention"}],"blockers":[{"id":"bd-304","blocks":["bd-303"]}],"rejected_candidates":[{"id":"bd-303","reason":"Highest PageRank among performance Beads but blocked by bd-304."}]},"next_action":{"command":"br update bd-302 --status in_progress","destructive":false},"caveats":[]}
