{
  "schema_version": "bead-selection.v1",
  "request": "Select the next unblocked Bead from the local Beads graph.",
  "mode": "next",
  "selected_bead": {
    "id": "bd-301",
    "title": "Implement user authentication flow",
    "status": "open",
    "reason": "Highest PageRank among ready, unblocked Beads with clear execution path."
  },
  "commands_used": [
    {
      "command": "bv --robot-next",
      "why": "Direct next recommendation from robot mode."
    },
    {
      "command": "bv --robot-triage",
      "why": "Verified no blockers or graph health issues affect selection."
    }
  ],
  "graph_evidence": {
    "primary_signal": "ready_high_pagerank",
    "signals": [
      { "bead_id": "bd-301", "metric": "pagerank", "value": 0.55, "source_command": "bv --robot-triage" },
      { "bead_id": "bd-301", "metric": "betweenness", "value": 0.33, "source_command": "bv --robot-triage" }
    ],
    "blockers": [],
    "rejected_candidates": [{"id": "bd-302", "reason": "Lower PageRank; selected bd-301 for higher impact."}]
  },
  "next_action": { "command": "br update bd-301 --status in_progress", "destructive": false },
  "caveats": []
}
