{"schema_version":"bead-selection.v1","request":"Choose the best Bead to work on next. Some Beads are blocked on work in other repositories that cannot be addressed in this workspace. Identify which Beads are actionable locally.","mode":"triage","selected_bead":{"id":"bd-305","title":"Local configuration loader fix","status":"open","reason":"Locally ready Bead with no cross-repository blockers. Has moderate PageRank and unblocks bd-310."},"commands_used":[{"command":"bv --robot-triage","why":"Assessed recommendations, blocker types, and local readiness."},{"command":"bv --robot-insights","why":"Identified cross-repository blocker on bd-301."}],"graph_evidence":{"primary_signal":"ready_local_no_cross_repo_blockers","signals":[{"bead_id":"bd-305","metric":"betweenness","value":0.21,"source_command":"bv --robot-triage"},{"bead_id":"bd-305","metric":"unblocks","value":1,"source_command":"bv --robot-triage"}],"blockers":[{"id":"bd-305","blocks":["bd-310"]}],"rejected_candidates":[{"id":"bd-301","reason":"Blocked on remote work in org/repo:bd-999, cannot be addressed in this local workspace."}]},"next_action":{"command":"br update bd-305 --status in_progress","destructive":false},"caveats":[]}
